<thumbnail  xmlns:xsi="http://www.w3.org/2001/XMLSchema-instance"
  	xsi:noNamespaceSchemaLocation="expkg-zone58:image.thumbnailator/schema/task.xsd">
	<size width="500" height="500" />
	<filters>
		<colorize color="#FF0096" alpha=".4" />
		<caption position="CENTER" color="white" size="30" font="SansSerif">Some Text here</caption>

		<rotate angle="15" />
		<canvas height="500" width="500" position="TOP_LEFT" color="black" />
		<watermark src="{$watermark}" alpha=".8" position="TOP_LEFT" />
	</filters>
</thumbnail>